{
  "schema_version": 1,
  "generated_at": "2026-08-14T03:53:20Z",
  "collection_status": "metadata_verified_only",
  "raw_root": "raw/individual-whole-bed-allowlist",
  "source": "Individually reviewed Wikimedia Commons file allowlist",
  "images": [
    {
      "source_id": "kalipur-hatchery",
      "source_page_url": "https://commons.wikimedia.org/wiki/File:Turtle_hatchery.jpg",
      "original_url": "https://upload.wikimedia.org/wikipedia/commons/8/83/Turtle_hatchery.jpg?utm_source=commons.wikimedia.org&utm_campaign=imageinfo&utm_content=original",
      "title": "File:Turtle hatchery.jpg",
      "facility": "Kalipur Beach turtle hatchery, Andaman and Nicobar Islands",
      "country": "India",
      "scene_group": "kalipur-beach",
      "visual_review": "Bamboo-walled sand hatchery with circular nest guards.",
      "expected_license": "CC BY-SA 4.0",
      "license": "CC BY-SA 4.0",
      "license_url": "https://creativecommons.org/licenses/by-sa/4.0",
      "author": "Arpandhar",
      "credit": "Own work",
      "credit_verification": "matched",
      "expected_mime": "image/jpeg",
      "remote_mime": "image/jpeg",
      "local_filename": "",
      "local_mime": "",
      "sha256": "",
      "width": "5184",
      "height": "3456",
      "source_page_id": "49813751",
      "source_timestamp": "",
      "verified_at": "2026-08-14T03:53:20Z"
    },
    {
      "source_id": "ostional-widecast",
      "source_page_url": "https://commons.wikimedia.org/wiki/File:Jairo_Mora_Sandoval_WIDECAST_2.jpg",
      "original_url": "https://upload.wikimedia.org/wikipedia/commons/4/4f/Jairo_Mora_Sandoval_WIDECAST_2.jpg?utm_source=commons.wikimedia.org&utm_campaign=imageinfo&utm_content=original",
      "title": "File:Jairo Mora Sandoval WIDECAST 2.jpg",
      "facility": "Ostional Beach Leatherback and Pacific Green Sea Turtle Project",
      "country": "Costa Rica",
      "scene_group": "ostional-widecast",
      "visual_review": "Volunteers working inside the hatchery enclosure.",
      "expected_license": "CC BY-SA 3.0",
      "license": "CC BY-SA 3.0",
      "license_url": "https://creativecommons.org/licenses/by-sa/3.0",
      "author": "Photo taken by Christine Figgener",
      "credit": "Email from Didiher Chacón, director of WIDECAST",
      "credit_verification": "matched",
      "expected_mime": "image/jpeg",
      "remote_mime": "image/jpeg",
      "local_filename": "",
      "local_mime": "",
      "sha256": "",
      "width": "3264",
      "height": "2448",
      "source_page_id": "26526211",
      "source_timestamp": "",
      "verified_at": "2026-08-14T03:53:20Z"
    },
    {
      "source_id": "playa-dos-kraals",
      "source_page_url": "https://commons.wikimedia.org/wiki/File:Kemps_ridley_sea_turtle_kraals_playa_dos_Mexico.jpg",
      "original_url": "https://upload.wikimedia.org/wikipedia/commons/a/ac/Kemps_ridley_sea_turtle_kraals_playa_dos_Mexico.jpg?utm_source=commons.wikimedia.org&utm_campaign=imageinfo&utm_content=original",
      "title": "File:Kemps ridley sea turtle kraals playa dos Mexico.jpg",
      "facility": "Kemp’s ridley kraals, Playa Dos",
      "country": "Mexico",
      "scene_group": "rancho-nuevo-playa-dos",
      "visual_review": "Long mesh sand enclosure, ground-level exterior view.",
      "expected_license": "Public Domain",
      "license": "Public domain",
      "license_url": "https://commons.wikimedia.org/wiki/File:Kemps_ridley_sea_turtle_kraals_playa_dos_Mexico.jpg",
      "author": "Shearer Tom, U.S. Fish and Wildlife Service",
      "credit": "http://www.public-domain-image.com/public-domain-images-pictures-free-stock-photos/events-happenings-public-domain-images-pictures/kemps-ridley-sea-turtle-kraals-playa-dos-mexico.jpg",
      "credit_verification": "matched",
      "expected_mime": "image/jpeg",
      "remote_mime": "image/jpeg",
      "local_filename": "",
      "local_mime": "",
      "sha256": "",
      "width": "2048",
      "height": "1536",
      "source_page_id": "24923259",
      "source_timestamp": "",
      "verified_at": "2026-08-14T03:53:20Z"
    },
    {
      "source_id": "playa-la-barqueta-vivero",
      "source_page_url": "https://commons.wikimedia.org/wiki/File:Vivero_de_Tortugas_La_Mochila.jpg",
      "original_url": "https://upload.wikimedia.org/wikipedia/commons/7/73/Vivero_de_Tortugas_La_Mochila.jpg?utm_source=commons.wikimedia.org&utm_campaign=imageinfo&utm_content=original",
      "title": "File:Vivero de Tortugas La Mochila.jpg",
      "facility": "Playa La Barqueta Wildlife Refuge turtle nursery, Chiriquí",
      "country": "Panama",
      "scene_group": "playa-la-barqueta",
      "visual_review": "Distinct beach nursery and enclosure.",
      "expected_license": "CC BY-SA 3.0",
      "license": "CC BY-SA 3.0",
      "license_url": "https://creativecommons.org/licenses/by-sa/3.0",
      "author": "Héctor Ruíz Palma",
      "credit": "This file was provided to Wikimedia Commons as part of the project La Mochila through Fundación Almanaque Azul .",
      "credit_verification": "matched",
      "expected_mime": "image/jpeg",
      "remote_mime": "image/jpeg",
      "local_filename": "",
      "local_mime": "",
      "sha256": "",
      "width": "2816",
      "height": "2112",
      "source_page_id": "34250168",
      "source_timestamp": "",
      "verified_at": "2026-08-14T03:53:20Z"
    },
    {
      "source_id": "playa-mayorquina",
      "source_page_url": "https://commons.wikimedia.org/wiki/File:Playa_mayorquina.jpg",
      "original_url": "https://upload.wikimedia.org/wikipedia/commons/e/ec/Playa_mayorquina.jpg?utm_source=commons.wikimedia.org&utm_campaign=imageinfo&utm_content=original",
      "title": "File:Playa mayorquina.jpg",
      "facility": "Turtle breeding area/reservoir, Morrocoy National Park, Tucacas, Falcón",
      "country": "Venezuela",
      "scene_group": "playa-mayorquina",
      "visual_review": "Wide outdoor turtle breeding-area/reservoir context.",
      "expected_license": "CC BY 3.0",
      "license": "CC BY 3.0",
      "license_url": "https://creativecommons.org/licenses/by/3.0",
      "author": "NelsonMendoza99",
      "credit": "Own work",
      "credit_verification": "matched",
      "expected_mime": "image/jpeg",
      "remote_mime": "image/jpeg",
      "local_filename": "",
      "local_mime": "",
      "sha256": "",
      "width": "2048",
      "height": "1536",
      "source_page_id": "32850727",
      "source_timestamp": "",
      "verified_at": "2026-08-14T03:53:20Z"
    },
    {
      "source_id": "rancho-nuevo-kraals",
      "source_page_url": "https://commons.wikimedia.org/wiki/File:Sea_Turtle_Kraals_Rancho_Nuevo,_Mexico_-_DPLA_-_910d40d932a20c64a822730c0ad53ced.jpg",
      "original_url": "https://upload.wikimedia.org/wikipedia/commons/1/12/Sea_Turtle_Kraals_Rancho_Nuevo%2C_Mexico_-_DPLA_-_910d40d932a20c64a822730c0ad53ced.jpg?utm_source=commons.wikimedia.org&utm_campaign=imageinfo&utm_content=original",
      "title": "File:Sea Turtle Kraals Rancho Nuevo, Mexico - DPLA - 910d40d932a20c64a822730c0ad53ced.jpg",
      "facility": "Kemp’s ridley incubation kraal, Rancho Nuevo, Tamaulipas",
      "country": "Mexico",
      "scene_group": "rancho-nuevo-playa-dos",
      "visual_review": "Whole marked-nest sand bed in a green mesh kraal.",
      "expected_license": "Public Domain",
      "license": "Public domain",
      "license_url": "https://commons.wikimedia.org/wiki/File:Sea_Turtle_Kraals_Rancho_Nuevo,_Mexico_-_DPLA_-_910d40d932a20c64a822730c0ad53ced.jpg",
      "author": "Department of the Interior. U.S. Fish and Wildlife Service. National Conservation Training Center. 10/1997-8888",
      "credit": "File URL Catalog record",
      "credit_verification": "matched",
      "expected_mime": "image/jpeg",
      "remote_mime": "image/jpeg",
      "local_filename": "",
      "local_mime": "",
      "sha256": "",
      "width": "2048",
      "height": "1536",
      "source_page_id": "193825281",
      "source_timestamp": "",
      "verified_at": "2026-08-14T03:53:20Z"
    },
    {
      "source_id": "san-san-pond-sak-vivero",
      "source_page_url": "https://commons.wikimedia.org/wiki/File:Vivero_de_tortugas_en_la_playa_La_Mochila.jpg",
      "original_url": "https://upload.wikimedia.org/wikipedia/commons/c/c0/Vivero_de_tortugas_en_la_playa_La_Mochila.jpg?utm_source=commons.wikimedia.org&utm_campaign=imageinfo&utm_content=original",
      "title": "File:Vivero de tortugas en la playa La Mochila.jpg",
      "facility": "San San Pond Sak beach turtle nursery, Bocas del Toro",
      "country": "Panama",
      "scene_group": "san-san-pond-sak",
      "visual_review": "Landscape beach nursery enclosure.",
      "expected_license": "CC BY-SA 3.0",
      "license": "CC BY-SA 3.0",
      "license_url": "https://creativecommons.org/licenses/by-sa/3.0",
      "author": "Yamireyka Bethancourt, Karen Avila y Antonio Alvarado",
      "credit": "This file was provided to Wikimedia Commons as part of the project La Mochila through Fundación Almanaque Azul .",
      "credit_verification": "matched",
      "expected_mime": "image/jpeg",
      "remote_mime": "image/jpeg",
      "local_filename": "",
      "local_mime": "",
      "sha256": "",
      "width": "4000",
      "height": "3000",
      "source_page_id": "34250171",
      "source_timestamp": "",
      "verified_at": "2026-08-14T03:53:20Z"
    },
    {
      "source_id": "tlalcoyunque-exterior",
      "source_page_url": "https://commons.wikimedia.org/wiki/File:TurtleHatcheryTlalcoyunque.JPG",
      "original_url": "https://upload.wikimedia.org/wikipedia/commons/5/51/TurtleHatcheryTlalcoyunque.JPG?utm_source=commons.wikimedia.org&utm_campaign=imageinfo&utm_content=original",
      "title": "File:TurtleHatcheryTlalcoyunque.JPG",
      "facility": "Tlalcoyunque hatching area, Guerrero",
      "country": "Mexico",
      "scene_group": "tlalcoyunque",
      "visual_review": "Wide exterior view of a net-canopy sand bed.",
      "expected_license": "CC BY-SA 4.0",